{
  "name": "readExpr: a shaped read projects and filters an array through the manifest dialect",
  "description": "Seeds an array of rows, then a node whose `readExpr` edges evaluate JSONata expressions against the state snapshot (a value position, like derive/assign-from) to project every row's label and to filter to the done ones. Any conforming kernel MUST expose the shaped results through the resolved tree — proving the readExpr edge is interpreted identically across kernels. The projections are bracket-wrapped ([...]) so the JSONata result is a materialized plain array rather than a singleton/sequence.",
  "vocabulary": {
    "gik": "0.1",
    "type": "vocabulary",
    "payload": {
      "version": "readexpr-demo/1.0",
      "expression": "jsonata",
      "namespaces": ["card_data"],
      "actions": ["assign", "derive", "invoke", "emit", "route", "confirm"],
      "capabilities": { "panel": {} }
    }
  },
  "program": {
    "gik": "0.1",
    "type": "program",
    "payload": {
      "vocabulary": "readexpr-demo/1.0",
      "root": {
        "capability": "panel",
        "id": "p",
        "edges": {
          "readExpr": {
            "allLabels": "[card_data.rows.label]",
            "doneLabels": "[card_data.rows[done].label]"
          }
        }
      }
    }
  },
  "seed": [
    {
      "op": "set",
      "path": "card_data.rows",
      "value": [
        { "label": "a", "done": true },
        { "label": "b", "done": false },
        { "label": "c", "done": true }
      ]
    }
  ],
  "expectInitialResolve": [{ "id": "p", "props": { "allLabels": ["a", "b", "c"], "doneLabels": ["a", "c"] } }]
}
